{
  "document": {
    "title": "本地优先 AI 助理落地研究",
    "subtitle": "深度研究报告",
    "versionLabel": "",
    "documentDate": ""
  },
  "sections": [
    {
      "sectionId": "sec-1",
      "title": "研究范围",
      "paragraphs": [{"text": "本报告仅覆盖已提供材料中可验证的事实。"}]
    }
  ],
  "tables": [],
  "figures": [],
  "images": []
}
